source,title,company,experience,salary,location,skills,posted,job_link,search_query,scraped_at,title_clean,job_category,exp_min_years,is_fresher_friendly,salary_clean,skills_list,skills_clean,skills_list_str
Naukri,Data Scientist,Verdantas,4-7 Yrs,Not Disclosed,Pune,"emerging technologies, algorithms, python, data analysis, mathematics, power bi, visualization tools, machine learning",2 days ago,https://www.naukri.com/job-listings-data-scientist-verdantas-pune-4-to-7-years-280426501494,Data Scientist,2026-04-30 19:31:42,data scientist,Data Scientist,4.0,False,,"['emerging technologies', 'algorithms', 'python', 'data analysis', 'mathematics', 'power bi', 'visualization tools', 'machine learning']","emerging technologies, algorithms, python, data analysis, mathematics, power bi, visualization tools, machine learning","emerging technologies, algorithms, python, data analysis, mathematics, power bi, visualization tools, machine learning"
Naukri,Data Scientist - Innovation,Comscore Technologies,1-4 Yrs,Not Disclosed,"Pune, Noida","algorithms, python, modeling, natural language processing, neural networks, algorithm development, machine learning, research",1 day ago,https://www.naukri.com/job-listings-data-scientist-innovation-comscore-technologies-noida-pune-1-to-4-years-290426030109,Data Scientist,2026-04-30 19:31:43,data scientist - innovation,Data Scientist,1.0,True,,"['algorithms', 'python', 'modeling', 'natural language processing', 'neural networks', 'algorithm development', 'machine learning', 'research']","algorithms, python, modeling, natural language processing, neural networks, algorithm development, machine learning, research","algorithms, python, modeling, natural language processing, neural networks, algorithm development, machine learning, research"
Naukri,Data Scientist,Generac Captiva,3-6 Yrs,Not Disclosed,Pune,"data scientist, Data Science, Machine Learning, Science, Machine, Data",Few hours ago,https://www.naukri.com/job-listings-data-scientist-generac-captiva-pune-3-to-6-years-300426024003,Data Scientist,2026-04-30 19:31:43,data scientist,Data Scientist,3.0,False,,"['data scientist', 'data science', 'machine learning', 'science', 'machine', 'data']","data scientist, data science, machine learning, science, machine, data","data scientist, data science, machine learning, science, machine, data"
Naukri,Data Scientist,Cloudxtreme,5-6 Yrs,Not Disclosed,"Hybrid - Pune, Hyderabad, Bengaluru","LLMs, AWS Redshift, PySpark, Model Fine-Tuning, Python, Predictive Modeling, Tableau, Deep Learning",Today,https://www.naukri.com/job-listings-data-scientist-cloudxtreme-hyderabad-pune-bengaluru-5-to-6-years-300426010435,Data Scientist,2026-04-30 19:31:43,data scientist,Data Scientist,5.0,False,,"['llms', 'aws redshift', 'pyspark', 'model fine-tuning', 'python', 'predictive modeling', 'tableau', 'deep learning']","llms, aws redshift, pyspark, model fine-tuning, python, predictive modeling, tableau, deep learning","llms, aws redshift, pyspark, model fine-tuning, python, predictive modeling, tableau, deep learning"
Naukri,Data Scientist,Teksystems,10-12 Yrs,Not Disclosed,Pune,"deep learning, Neural networks, Machine learning, Programming, model development, Transformers, Data analytics, Fraud detection",2 days ago,https://www.naukri.com/job-listings-data-scientist-teksystems-pune-10-to-12-years-280426502726,Data Scientist,2026-04-30 19:31:45,data scientist,Data Scientist,10.0,False,,"['deep learning', 'neural networks', 'machine learning', 'programming', 'model development', 'transformers', 'data analytics', 'fraud detection']","deep learning, neural networks, machine learning, programming, model development, transformers, data analytics, fraud detection","deep learning, neural networks, machine learning, programming, model development, transformers, data analytics, fraud detection"
Naukri,Senior Data Scientist (Machine Learning),Tredence,5-8 Yrs,Not Disclosed,"Hybrid - Pune, Hyderabad, Bengaluru","Advanced Analytics, Machine Learning, Predictive Modeling, Artificial Intelligence, Statistical Modeling, Data Analytics, Statistics, Predictive Analytics",6 days ago,https://www.naukri.com/job-listings-senior-data-scientist-machine-learning-tredence-hyderabad-pune-bengaluru-5-to-8-years-240426012885,Data Scientist,2026-04-30 19:31:45,senior data scientist (machine learning),Data Scientist,5.0,False,,"['advanced analytics', 'machine learning', 'predictive modeling', 'artificial intelligence', 'statistical modeling', 'data analytics', 'statistics', 'predictive analytics']","advanced analytics, machine learning, predictive modeling, artificial intelligence, statistical modeling, data analytics, statistics, predictive analytics","advanced analytics, machine learning, predictive modeling, artificial intelligence, statistical modeling, data analytics, statistics, predictive analytics"
Naukri,Data Scientist AIML (Berribot AI),Tata Consultancy Services,5-10 Yrs,Not Disclosed,"Pune, Hyderabad, Bengaluru","Data Science, Artificial Intelligence, Machine Learning, Python, Data, Machine, Intelligence, Science",1 day ago,https://www.naukri.com/job-listings-data-scientist-aiml-berribot-ai-tata-consultancy-services-hyderabad-pune-bengaluru-5-to-10-years-290426011150,Data Scientist,2026-04-30 19:31:46,data scientist aiml (berribot ai),Data Scientist,5.0,False,,"['data science', 'artificial intelligence', 'machine learning', 'python', 'data', 'machine', 'intelligence', 'science']","data science, artificial intelligence, machine learning, python, data, machine, intelligence, science","data science, artificial intelligence, machine learning, python, data, machine, intelligence, science"
Naukri,Data Scientist-AIML,Leading IT Service and Consulting Organization,3-8 Yrs,Not Disclosed,"Hybrid - Pune, Hyderabad, Chennai","Large Language Model, Artificial Intelligence, Natural Language Processing, Machine Learning, Python, Tensorflow, Pytorch, Image Processing",6 days ago,https://www.naukri.com/job-listings-data-scientist-aiml-anlage-infotech-hyderabad-pune-chennai-3-to-8-years-230426035562,Data Scientist,2026-04-30 19:31:46,data scientist-aiml,Data Scientist,3.0,False,,"['large language model', 'artificial intelligence', 'natural language processing', 'machine learning', 'python', 'tensorflow', 'pytorch', 'image processing']","large language model, artificial intelligence, natural language processing, machine learning, python, tensorflow, pytorch, image processing","large language model, artificial intelligence, natural language processing, machine learning, python, tensorflow, pytorch, image processing"
Naukri,Azure Data Scientist,Unify Dots,3-5 Yrs,Not Disclosed,Pune,"Data analysis, Data validation, Data modeling, Analytical, Machine learning, SDK, Information technology, Analytics",2 days ago,https://www.naukri.com/job-listings-azure-data-scientist-unify-dots-pune-3-to-5-years-280426501076,Data Scientist,2026-04-30 19:31:46,azure data scientist,Data Scientist,3.0,False,,"['data analysis', 'data validation', 'data modeling', 'analytical', 'machine learning', 'sdk', 'information technology', 'analytics']","data analysis, data validation, data modeling, analytical, machine learning, sdk, information technology, analytics","data analysis, data validation, data modeling, analytical, machine learning, sdk, information technology, analytics"
Naukri,Data Scientist,Experis,5-10 Yrs,Not Disclosed,"Pune, Hyderabad, Bengaluru","Machine Learning, Data Science, AWS, Generative AI, RAG, MLflow, LLM, Microservices",Few hours ago,https://www.naukri.com/job-listings-data-scientist-experis-hyderabad-pune-bengaluru-5-to-10-years-300426026488,Data Scientist,2026-04-30 19:31:47,data scientist,Data Scientist,5.0,False,,"['machine learning', 'data science', 'aws', 'generative ai', 'rag', 'mlflow', 'llm', 'microservices']","machine learning, data science, aws, generative ai, rag, mlflow, llm, microservices","machine learning, data science, aws, generative ai, rag, mlflow, llm, microservices"
Naukri,Data Scientist,Credence Resource Management,3-8 Yrs,Not Disclosed,Pune,"Computer science, Data analysis, Data modeling, Healthcare, Workflow, US healthcare, Business intelligence, Analytics",1 day ago,https://www.naukri.com/job-listings-data-scientist-credence-resource-management-pvt-ltd-pune-3-to-8-years-290426500781,Data Scientist,2026-04-30 19:31:47,data scientist,Data Scientist,3.0,False,,"['computer science', 'data analysis', 'data modeling', 'healthcare', 'workflow', 'us healthcare', 'business intelligence', 'analytics']","computer science, data analysis, data modeling, healthcare, workflow, us healthcare, business intelligence, analytics","computer science, data analysis, data modeling, healthcare, workflow, us healthcare, business intelligence, analytics"
Naukri,Data Scientist-4-9Yrs-PAN INDIA,Crescendo Global Leadership Hiring India,4-9 Yrs,Not Disclosed,"Hybrid - Pune, Bengaluru, Delhi / NCR","Data scientist, Agentic Ai, Generative Ai, Aiml, Python, Data Science, GenAI, Artificial Intelligence",2 days ago,https://www.naukri.com/job-listings-data-scientist-4-9yrs-pan-india-crescendo-global-leadership-hiring-india-pune-bengaluru-delhi-ncr-4-to-9-years-280426007134,Data Scientist,2026-04-30 19:31:47,data scientist-4-9yrs-pan india,Data Scientist,4.0,False,,"['data scientist', 'agentic ai', 'generative ai', 'aiml', 'python', 'data science', 'genai', 'artificial intelligence']","data scientist, agentic ai, generative ai, aiml, python, data science, genai, artificial intelligence","data scientist, agentic ai, generative ai, aiml, python, data science, genai, artificial intelligence"
Naukri,Data Scientist,Leading Client,5-10 Yrs,Not Disclosed,Pune,"Data Scientist, Azure, Api Development, Apis, Ai, User Experience, Programming, Data Extraction",1 day ago,https://www.naukri.com/job-listings-data-scientist-tekskills-india-private-limited-pune-5-to-10-years-290426925467,Data Scientist,2026-04-30 19:31:48,data scientist,Data Scientist,5.0,False,,"['data scientist', 'azure', 'api development', 'apis', 'ai', 'user experience', 'programming', 'data extraction']","data scientist, azure, api development, apis, ai, user experience, programming, data extraction","data scientist, azure, api development, apis, ai, user experience, programming, data extraction"
Naukri,Data Scientist,Maddisoft Solutions,0-5 Yrs,Not Disclosed,"Pune, Hyderabad","Power Bi Reports, Regression, Data Visualization, Clustering, Python, Excel, Power Bi, Factoring",4 days ago,https://www.naukri.com/job-listings-data-scientist-maddisoft-solutions-hyderabad-pune-0-to-5-years-171025022506,Data Scientist,2026-04-30 19:31:55,data scientist,Data Scientist,0.0,True,,"['power bi reports', 'regression', 'data visualization', 'clustering', 'python', 'excel', 'power bi', 'factoring']","power bi reports, regression, data visualization, clustering, python, excel, power bi, factoring","power bi reports, regression, data visualization, clustering, python, excel, power bi, factoring"
Naukri,Data Scientist,Pratiti Technologies,2-5 Yrs,Not Disclosed,Hybrid - Pune,"Tensorflow, Pytorch, Opencv, Machine Learning, Python, Deep Learning, Scikit-Learn, SQL",1 day ago,https://www.naukri.com/job-listings-data-scientist-pratiti-technologies-pune-2-to-5-years-290426014293,Data Scientist,2026-04-30 19:31:56,data scientist,Data Scientist,2.0,False,,"['tensorflow', 'pytorch', 'opencv', 'machine learning', 'python', 'deep learning', 'scikit-learn', 'sql']","tensorflow, pytorch, opencv, machine learning, python, deep learning, scikit-learn, sql","tensorflow, pytorch, opencv, machine learning, python, deep learning, scikit-learn, sql"
Naukri,Data Scientist,IntraEdge Technology,5-9 Yrs,Not Disclosed,Remote,"jupyter, Neural Networks, Statistics, Linear Algebra, Python, Predictive Modeling, LLM, SQL",1 week ago,https://www.naukri.com/job-listings-data-scientist-intraedge-technology-pune-5-to-9-years-230426018995,Data Scientist,2026-04-30 19:31:56,data scientist,Data Scientist,5.0,False,,"['jupyter', 'neural networks', 'statistics', 'linear algebra', 'python', 'predictive modeling', 'llm', 'sql']","jupyter, neural networks, statistics, linear algebra, python, predictive modeling, llm, sql","jupyter, neural networks, statistics, linear algebra, python, predictive modeling, llm, sql"
Naukri,"Lead Data Scientist, AI and Machine Learning",Hilabs,3-8 Yrs,Not Disclosed,Pune,"Python or Scala programming, AI and Machine Learning, Python, Applied ML in healthcare, ML best practices, ML algorithms and mathematics, big data processing, model deployment and optimization",3 days ago,https://www.naukri.com/job-listings-lead-data-scientist-ai-and-machine-learning-hilabs-pune-3-to-8-years-080126022816,Data Scientist,2026-04-30 19:31:57,"lead data scientist, ai and machine learning",Data Scientist,3.0,False,,"['python or scala programming', 'ai and machine learning', 'python', 'applied ml in healthcare', 'ml best practices', 'ml algorithms and mathematics', 'big data processing', 'model deployment and optimization']","python or scala programming, ai and machine learning, python, applied ml in healthcare, ml best practices, ml algorithms and mathematics, big data processing, model deployment and optimization","python or scala programming, ai and machine learning, python, applied ml in healthcare, ml best practices, ml algorithms and mathematics, big data processing, model deployment and optimization"
Naukri,Data Scientist,InfoCepts,7-9 Yrs,Not Disclosed,Pune,"Supply chain, Basic, Data analysis, data science, Analytical, Machine learning, Deployment, Monitoring",2 weeks ago,https://www.naukri.com/job-listings-data-scientist-infocepts-pune-7-to-9-years-160426502598,Data Scientist,2026-04-30 19:31:57,data scientist,Data Scientist,7.0,False,,"['supply chain', 'basic', 'data analysis', 'data science', 'analytical', 'machine learning', 'deployment', 'monitoring']","supply chain, basic, data analysis, data science, analytical, machine learning, deployment, monitoring","supply chain, basic, data analysis, data science, analytical, machine learning, deployment, monitoring"
Naukri,Data Scientist,Globant,5-10 Yrs,Not Disclosed,"Pune, Hyderabad, Bengaluru","Generative Ai, Data Science, Langchain, Artificial Intelligence, Natural Language Processing, Retrieval Augmented Generation, Computer Vision, Machine Learning",1 week ago,https://www.naukri.com/job-listings-data-scientist-globant-hyderabad-pune-bengaluru-5-to-10-years-230426029260,Data Scientist,2026-04-30 19:31:57,data scientist,Data Scientist,5.0,False,,"['generative ai', 'data science', 'langchain', 'artificial intelligence', 'natural language processing', 'retrieval augmented generation', 'computer vision', 'machine learning']","generative ai, data science, langchain, artificial intelligence, natural language processing, retrieval augmented generation, computer vision, machine learning","generative ai, data science, langchain, artificial intelligence, natural language processing, retrieval augmented generation, computer vision, machine learning"
Naukri,Data Scientist AIML,Tata Consultancy Services,5-10 Yrs,Not Disclosed,"Pune, Hyderabad, Chennai","AI Agents, Data Scientist, AIML, Chat bots, RAG, Chatbot, Bot, Artificial Intelligence",6 days ago,https://www.naukri.com/job-listings-data-scientist-aiml-tata-consultancy-services-hyderabad-pune-chennai-5-to-10-years-240426011912,Data Scientist,2026-04-30 19:31:58,data scientist aiml,Data Scientist,5.0,False,,"['ai agents', 'data scientist', 'aiml', 'chat bots', 'rag', 'chatbot', 'bot', 'artificial intelligence']","ai agents, data scientist, aiml, chat bots, rag, chatbot, bot, artificial intelligence","ai agents, data scientist, aiml, chat bots, rag, chatbot, bot, artificial intelligence"
Naukri,Gen AI Data Scientist,Tata Consultancy Services,4-9 Yrs,Not Disclosed,"Pune, Kolkata, New Delhi","Data Science, Machine Learning, Artificial Intelligence, Python, Science, Machine, Intelligence, Data",2 weeks ago,https://www.naukri.com/job-listings-gen-ai-data-scientist-tata-consultancy-services-kolkata-new-delhi-pune-4-to-9-years-150426019751,Data Scientist,2026-04-30 19:31:58,gen ai data scientist,Data Scientist,4.0,False,,"['data science', 'machine learning', 'artificial intelligence', 'python', 'science', 'machine', 'intelligence', 'data']","data science, machine learning, artificial intelligence, python, science, machine, intelligence, data","data science, machine learning, artificial intelligence, python, science, machine, intelligence, data"
Naukri,Urgent Hiring - Data Scientist (Gen Al),Calsoft,5-10 Yrs,Not Disclosed,"Hybrid - Pune, Kolkata","Agentic Ai, MCP, Retrieval Augmented Generation, AWS, Python, Predictive Modeling, Genrative Ai, Langchain",1 week ago,https://www.naukri.com/job-listings-urgent-hiring-data-scientist-gen-al-calsoft-kolkata-pune-5-to-10-years-170426018365,Data Scientist,2026-04-30 19:31:58,urgent hiring - data scientist (gen al),Data Scientist,5.0,False,,"['agentic ai', 'mcp', 'retrieval augmented generation', 'aws', 'python', 'predictive modeling', 'genrative ai', 'langchain']","agentic ai, mcp, retrieval augmented generation, aws, python, predictive modeling, genrative ai, langchain","agentic ai, mcp, retrieval augmented generation, aws, python, predictive modeling, genrative ai, langchain"
Naukri,Data Scientist,Tekskills india,7-10 Yrs,Not Disclosed,Pune,"Azure, Data Scientist, Databricks Synapse, ML/AI, Ml, Artificial Intelligence, Data, Microsoft Azure",2 days ago,https://www.naukri.com/job-listings-data-scientist-tekskills-pune-7-to-10-years-280426934136,Data Scientist,2026-04-30 19:31:59,data scientist,Data Scientist,7.0,False,,"['azure', 'data scientist', 'databricks synapse', 'ml/ai', 'ml', 'artificial intelligence', 'data', 'microsoft azure']","azure, data scientist, databricks synapse, ml/ai, ml, artificial intelligence, data, microsoft azure","azure, data scientist, databricks synapse, ml/ai, ml, artificial intelligence, data, microsoft azure"
Naukri,Data Scientists - Gen AI / Agentic AI,Kanini Software Solutions,5-10 Yrs,Not Disclosed,"Hybrid - Pune, Chennai, Bengaluru","Agentic Ai, Generative Ai, Large Language Model, Azure Cloud, Retrieval Augmented Generation, Crewai, Languages, Large",1 week ago,https://www.naukri.com/job-listings-data-scientists-gen-ai-agentic-ai-kanini-software-solutions-pune-chennai-bengaluru-5-to-10-years-210426018859,Data Scientist,2026-04-30 19:31:59,data scientists - gen ai / agentic ai,Data Scientist,5.0,False,,"['agentic ai', 'generative ai', 'large language model', 'azure cloud', 'retrieval augmented generation', 'crewai', 'languages', 'large']","agentic ai, generative ai, large language model, azure cloud, retrieval augmented generation, crewai, languages, large","agentic ai, generative ai, large language model, azure cloud, retrieval augmented generation, crewai, languages, large"
Naukri,Data Scientist(Gen AI)-4-9Yrs-PAN INDIA,Crescendo Global Leadership Hiring India,4-9 Yrs,15-30 Lacs PA,"Hybrid - Pune, Bengaluru, Delhi / NCR","Data Science, Generative Ai, Natural Language Processing, Machine Learning, Tensorflow, Pytorch, Artificial Intelligence, Aiml",6 days ago,https://www.naukri.com/job-listings-data-scientist-gen-ai-4-9yrs-pan-india-crescendo-global-leadership-hiring-india-pune-bengaluru-delhi-ncr-4-to-9-years-140426009521,Data Scientist,2026-04-30 19:31:59,data scientist(gen ai)-4-9yrs-pan india,Data Scientist,4.0,False,15-30 Lacs PA,"['data science', 'generative ai', 'natural language processing', 'machine learning', 'tensorflow', 'pytorch', 'artificial intelligence', 'aiml']","data science, generative ai, natural language processing, machine learning, tensorflow, pytorch, artificial intelligence, aiml","data science, generative ai, natural language processing, machine learning, tensorflow, pytorch, artificial intelligence, aiml"
Naukri,data scientist,CN Solutions,4-6 Yrs,Not Disclosed,Pune,"sql, data science, pytorch, machine learning algorithms, aws, algorithms, python, natural language processing",1 week ago,https://www.naukri.com/job-listings-data-scientist-cn-solutions-pune-4-to-6-years-210426909753,Data Scientist,2026-04-30 19:32:00,data scientist,Data Scientist,4.0,False,,"['sql', 'data science', 'pytorch', 'machine learning algorithms', 'aws', 'algorithms', 'python', 'natural language processing']","sql, data science, pytorch, machine learning algorithms, aws, algorithms, python, natural language processing","sql, data science, pytorch, machine learning algorithms, aws, algorithms, python, natural language processing"
Naukri,Data Scientist,Birlasoft,8-13 Yrs,Not Disclosed,Pune,"Performance tuning, Pharma, Machine learning, data governance, Data processing, Data quality, SDLC, Analytics",1 week ago,https://www.naukri.com/job-listings-data-scientist-birlasoft-india-limited-pune-8-to-13-years-170426501339,Data Scientist,2026-04-30 19:32:01,data scientist,Data Scientist,8.0,False,,"['performance tuning', 'pharma', 'machine learning', 'data governance', 'data processing', 'data quality', 'sdlc', 'analytics']","performance tuning, pharma, machine learning, data governance, data processing, data quality, sdlc, analytics","performance tuning, pharma, machine learning, data governance, data processing, data quality, sdlc, analytics"
Naukri,Data Scientist,IT MNC,10-15 Yrs,Not Disclosed,"Pune, Kolkata, Mumbai (All Areas)","Generative Ai, Artificial Intelligence, Machine Learning, Predictive Modeling, Data Science, Natural Language Processing, Statistical Modeling, Python",1 day ago,https://www.naukri.com/job-listings-data-scientist-erm-placement-services-kolkata-pune-mumbai-all-areas-10-to-15-years-290426012347,Data Scientist,2026-04-30 19:32:01,data scientist,Data Scientist,10.0,False,,"['generative ai', 'artificial intelligence', 'machine learning', 'predictive modeling', 'data science', 'natural language processing', 'statistical modeling', 'python']","generative ai, artificial intelligence, machine learning, predictive modeling, data science, natural language processing, statistical modeling, python","generative ai, artificial intelligence, machine learning, predictive modeling, data science, natural language processing, statistical modeling, python"
Naukri,Data Scientist,ZS,6-9 Yrs,28-40 Lacs PA,"Pune, Bengaluru, Delhi / NCR","Generative Ai, Machine Learning, Langchain, Langgraph, RAG, Data, Machine, Artificial Intelligence",1 week ago,https://www.naukri.com/job-listings-data-scientist-zs-pune-bengaluru-delhi-ncr-6-to-9-years-220426028508,Data Scientist,2026-04-30 19:32:02,data scientist,Data Scientist,6.0,False,28-40 Lacs PA,"['generative ai', 'machine learning', 'langchain', 'langgraph', 'rag', 'data', 'machine', 'artificial intelligence']","generative ai, machine learning, langchain, langgraph, rag, data, machine, artificial intelligence","generative ai, machine learning, langchain, langgraph, rag, data, machine, artificial intelligence"
Naukri,Machine Learning Engineer,Barclays,2-8 Yrs,Not Disclosed,Pune,"Data validation, Analytical, Machine learning, Vice President, Management, Risk management, Operations, Counselling",1 week ago,https://www.naukri.com/job-listings-machine-learning-engineer-barclays-shared-services-pune-2-to-8-years-170426501406,Machine Learning Engineer,2026-04-30 19:32:19,machine learning engineer,ML Engineer,2.0,False,,"['data validation', 'analytical', 'machine learning', 'vice president', 'management', 'risk management', 'operations', 'counselling']","data validation, analytical, machine learning, vice president, management, risk management, operations, counselling","data validation, analytical, machine learning, vice president, management, risk management, operations, counselling"
Naukri,Machine Learning Engineer II,General Mills,6-9 Yrs,Not Disclosed,"Hybrid - Pune, Mumbai(Powai)","MLOps, Machine Learning, GCP, Python, SQL, Machine",2 weeks ago,https://www.naukri.com/job-listings-machine-learning-engineer-ii-general-mills-mumbai-pune-6-to-9-years-130426029538,Machine Learning Engineer,2026-04-30 19:32:19,machine learning engineer ii,ML Engineer,6.0,False,,"['mlops', 'machine learning', 'gcp', 'python', 'sql', 'machine']","mlops, machine learning, gcp, python, sql, machine","mlops, machine learning, gcp, python, sql, machine"
Naukri,GenAI and Machine Learning Developer/Lead Role,Ltimindtree,8-13 Yrs,Not Disclosed,"Hybrid - Pune, Noida","Artificial Intelligence, Machine Learning, Python, Statistical Modeling, Development, Statistics, Machine, Intelligence",2 weeks ago,https://www.naukri.com/job-listings-genai-and-machine-learning-developer-lead-role-ltimindtree-noida-pune-8-to-13-years-140426016132,Machine Learning Engineer,2026-04-30 19:32:20,genai and machine learning developer/lead role,ML Engineer,8.0,False,,"['artificial intelligence', 'machine learning', 'python', 'statistical modeling', 'development', 'statistics', 'machine', 'intelligence']","artificial intelligence, machine learning, python, statistical modeling, development, statistics, machine, intelligence","artificial intelligence, machine learning, python, statistical modeling, development, statistics, machine, intelligence"
Naukri,Principal/Lead Data Scientist,Fractal Analytics,11-15 Yrs,Not Disclosed,"Pune, Mumbai, Chennai, Gurugram, Bengaluru","Training, deep learning, Team management, data science, GCP, Machine learning, Deployment, Monitoring",3+ weeks ago,https://www.naukri.com/job-listings-principal-lead-data-scientist-fractal-analytics-ltd-mumbai-pune-chennai-gurugram-bengaluru-11-to-15-years-040225507529,Machine Learning Engineer,2026-04-30 19:32:20,principal/lead data scientist,Data Scientist,11.0,False,,"['training', 'deep learning', 'team management', 'data science', 'gcp', 'machine learning', 'deployment', 'monitoring']","training, deep learning, team management, data science, gcp, machine learning, deployment, monitoring","training, deep learning, team management, data science, gcp, machine learning, deployment, monitoring"
