source,title,company,experience,salary,location,skills,posted,job_link,search_query,scraped_at,title_clean,job_category,exp_min_years,is_fresher_friendly,salary_clean,skills_list,skills_clean,skills_list_str
Naukri,Data Verification Analyst,Foundation Ai,0-5 Yrs,Not Disclosed,"Pune, Kolkata, Mumbai, New Delhi, Hyderabad, Chennai, Bengaluru","metadata, python, data analysis, data management, data analytics, data validation, configuration, data mining",3+ weeks ago,https://www.naukri.com/job-listings-data-verification-analyst-foundation-ai-kolkata-mumbai-new-delhi-hyderabad-pune-chennai-bengaluru-0-to-5-years-101224501433,Data Analyst,2026-04-30 19:31:07,data verification analyst,Other,0.0,True,,"['metadata', 'python', 'data analysis', 'data management', 'data analytics', 'data validation', 'configuration', 'data mining']","metadata, python, data analysis, data management, data analytics, data validation, configuration, data mining","metadata, python, data analysis, data management, data analytics, data validation, configuration, data mining"
Naukri,Data Analyst,Integrichain,2-4 Yrs,Not Disclosed,Pune,"Analytical skills, QA, Manager Quality Assurance, Excel, Time management, Pharma, Product sales, Data Analyst",1 week ago,https://www.naukri.com/job-listings-data-analyst-integrichain-pune-2-to-4-years-230426502781,Data Analyst,2026-04-30 19:31:07,data analyst,Data Analyst,2.0,False,,"['analytical skills', 'qa', 'manager quality assurance', 'excel', 'time management', 'pharma', 'product sales', 'data analyst']","analytical skills, qa, manager quality assurance, excel, time management, pharma, product sales, data analyst","analytical skills, qa, manager quality assurance, excel, time management, pharma, product sales, data analyst"
Naukri,Cloud Data Analyst,Jefferies Financial Group,7-12 Yrs,Not Disclosed,Pune,"Unix, Data analysis, Automation, Data modeling, Analytical, Social media, Investment banking, Business intelligence",1 week ago,https://www.naukri.com/job-listings-cloud-data-analyst-jefferies-group-llc-pune-7-to-12-years-170426500894,Data Analyst,2026-04-30 19:31:07,cloud data analyst,Data Analyst,7.0,False,,"['unix', 'data analysis', 'automation', 'data modeling', 'analytical', 'social media', 'investment banking', 'business intelligence']","unix, data analysis, automation, data modeling, analytical, social media, investment banking, business intelligence","unix, data analysis, automation, data modeling, analytical, social media, investment banking, business intelligence"
Naukri,Data Analyst,Ecolab Global Services,6-8 Yrs,Not Disclosed,Pune,"data analyst, data analysis, data systems, data governance, etl, elt, sql, System",1 week ago,https://www.naukri.com/job-listings-data-analyst-ecolab-global-services-private-limited-pune-6-to-8-years-210426932292,Data Analyst,2026-04-30 19:31:08,data analyst,Data Analyst,6.0,False,,"['data analyst', 'data analysis', 'data systems', 'data governance', 'etl', 'elt', 'sql', 'system']","data analyst, data analysis, data systems, data governance, etl, elt, sql, system","data analyst, data analysis, data systems, data governance, etl, elt, sql, system"
Naukri,Data Analyst,Freedom From Diabetes,3-8 Yrs,Not Disclosed,Pune,"Computer science, Automation, Data modeling, Analytical, Data processing, Data analytics, Data quality, Business intelligence",3+ weeks ago,https://www.naukri.com/job-listings-data-analyst-freedom-from-diabetes-pvt-ltd-pune-3-to-8-years-240326503473,Data Analyst,2026-04-30 19:31:09,data analyst,Data Analyst,3.0,False,,"['computer science', 'automation', 'data modeling', 'analytical', 'data processing', 'data analytics', 'data quality', 'business intelligence']","computer science, automation, data modeling, analytical, data processing, data analytics, data quality, business intelligence","computer science, automation, data modeling, analytical, data processing, data analytics, data quality, business intelligence"
Naukri,Data Analyst,AMS,4-9 Yrs,Not Disclosed,"Hybrid - Pune, Gurugram, Bengaluru","ETL, SQL, power BI, Tableau, Data, Data analysis, Bi",2 weeks ago,https://www.naukri.com/job-listings-data-analyst-ams-pune-gurugram-bengaluru-4-to-9-years-160426020198,Data Analyst,2026-04-30 19:31:09,data analyst,Data Analyst,4.0,False,,"['etl', 'sql', 'power bi', 'tableau', 'data', 'data analysis', 'bi']","etl, sql, power bi, tableau, data, data analysis, bi","etl, sql, power bi, tableau, data, data analysis, bi"
Naukri,Data Analyst,Dentsu Webchutney,3-8 Yrs,Not Disclosed,Pune,"business intelligence reporting, Database design, Analytical, DBMS, Data mining, Operations, Analytics, Reporting tools",2 weeks ago,https://www.naukri.com/job-listings-data-analyst-dentsu-inc-pune-3-to-8-years-160426504761,Data Analyst,2026-04-30 19:31:10,data analyst,Data Analyst,3.0,False,,"['business intelligence reporting', 'database design', 'analytical', 'dbms', 'data mining', 'operations', 'analytics', 'reporting tools']","business intelligence reporting, database design, analytical, dbms, data mining, operations, analytics, reporting tools","business intelligence reporting, database design, analytical, dbms, data mining, operations, analytics, reporting tools"
Naukri,Data Analyst,Kairos Technologies,8-13 Yrs,15-18 Lacs PA,"Hybrid - Pune, Hyderabad, Mumbai (All Areas)","Power Bi, Tableau, ETL, SQL, Python, Data, Bi, Data analysis",1 week ago,https://www.naukri.com/job-listings-data-analyst-kairos-technologies-hyderabad-pune-mumbai-all-areas-8-to-13-years-200426016029,Data Analyst,2026-04-30 19:31:10,data analyst,Data Analyst,8.0,False,15-18 Lacs PA,"['power bi', 'tableau', 'etl', 'sql', 'python', 'data', 'bi', 'data analysis']","power bi, tableau, etl, sql, python, data, bi, data analysis","power bi, tableau, etl, sql, python, data, bi, data analysis"
Naukri,Data Analyst,eClerx,5-10 Yrs,Not Disclosed,"Pune, Mumbai (All Areas)","Python, SQL, Data Analysis, Analysis, Data",1 week ago,https://www.naukri.com/job-listings-data-analyst-eclerx-pune-mumbai-all-areas-5-to-10-years-200426005743,Data Analyst,2026-04-30 19:31:10,data analyst,Data Analyst,5.0,False,,"['python', 'sql', 'data analysis', 'analysis', 'data']","python, sql, data analysis, analysis, data","python, sql, data analysis, analysis, data"
Naukri,Data Analyst with Hadoop,Asky Services Llp,5-7 Yrs,Not Disclosed,"Pune, Hyderabad, Gurugram, Bengaluru","metadata, python, data analysis, data management, data analytics, data validation, configuration, data mining",3+ weeks ago,https://www.naukri.com/job-listings-data-analyst-with-hadoop-asky-services-hyderabad-pune-gurugram-bengaluru-5-to-7-years-270825502639,Data Analyst,2026-04-30 19:31:11,data analyst with hadoop,Data Analyst,5.0,False,,"['metadata', 'python', 'data analysis', 'data management', 'data analytics', 'data validation', 'configuration', 'data mining']","metadata, python, data analysis, data management, data analytics, data validation, configuration, data mining","metadata, python, data analysis, data management, data analytics, data validation, configuration, data mining"
Naukri,Data Analyst,Nalco Water,4-8 Yrs,Not Disclosed,Pune,"Chemical, Cooling Tower, Chemical Engineering, Water Treatment, Tower, Data analysis, Water, Engineering",6 days ago,https://www.naukri.com/job-listings-data-analyst-nalco-water-pune-4-to-8-years-240426020052,Data Analyst,2026-04-30 19:31:11,data analyst,Data Analyst,4.0,False,,"['chemical', 'cooling tower', 'chemical engineering', 'water treatment', 'tower', 'data analysis', 'water', 'engineering']","chemical, cooling tower, chemical engineering, water treatment, tower, data analysis, water, engineering","chemical, cooling tower, chemical engineering, water treatment, tower, data analysis, water, engineering"
Naukri,Data Scientist-EDA,Wipro,5-7 Yrs,22.5-30 Lacs PA,"Pune, Chennai, Bengaluru","EDA, Artificial Intelligence, Machine Learning Algorithms, Data Analytics, Machine Learning, Advanced Analytics, Machine, Analytics",1 week ago,https://www.naukri.com/job-listings-data-scientist-eda-wipro-pune-chennai-bengaluru-5-to-7-years-210426033588,Data Scientist,2026-04-30 19:31:26,data scientist-eda,Data Scientist,5.0,False,22.5-30 Lacs PA,"['eda', 'artificial intelligence', 'machine learning algorithms', 'data analytics', 'machine learning', 'advanced analytics', 'machine', 'analytics']","eda, artificial intelligence, machine learning algorithms, data analytics, machine learning, advanced analytics, machine, analytics","eda, artificial intelligence, machine learning algorithms, data analytics, machine learning, advanced analytics, machine, analytics"
Naukri,Data Scientist AI/ML,Tata Consultancy Services,5-10 Yrs,Not Disclosed,"Pune, Bengaluru, Mumbai (All Areas)","Artificial Intelligence, Al, Machine Learning, Intelligence, Data, Machine, Ml",Today,https://www.naukri.com/job-listings-data-scientist-ai-ml-tata-consultancy-services-pune-bengaluru-mumbai-all-areas-5-to-10-years-300426014586,Data Scientist,2026-04-30 19:31:26,data scientist ai/ml,Data Scientist,5.0,False,,"['artificial intelligence', 'al', 'machine learning', 'intelligence', 'data', 'machine', 'ml']","artificial intelligence, al, machine learning, intelligence, data, machine, ml","artificial intelligence, al, machine learning, intelligence, data, machine, ml"
Naukri,Data Scientist - NLP Focused,Siemens,5-10 Yrs,Not Disclosed,Pune,"data scientist, rest, python, data analysis, natural language processing, forecasting, nltk, data mining",3 weeks ago,https://www.naukri.com/job-listings-data-scientist-nlp-focused-siemens-limited-pune-5-to-10-years-090426926646,Data Scientist,2026-04-30 19:31:26,data scientist - nlp focused,Data Scientist,5.0,False,,"['data scientist', 'rest', 'python', 'data analysis', 'natural language processing', 'forecasting', 'nltk', 'data mining']","data scientist, rest, python, data analysis, natural language processing, forecasting, nltk, data mining","data scientist, rest, python, data analysis, natural language processing, forecasting, nltk, data mining"
Naukri,AI ML/Data Scientist,Tata Consultancy Services,4-9 Yrs,Not Disclosed,"Pune, Hyderabad, Chennai","Data Science, Artificial Intelligence, Machine Learning, Science, Machine, Intelligence, Data, Ml",2 weeks ago,https://www.naukri.com/job-listings-ai-ml-data-scientist-tata-consultancy-services-hyderabad-pune-chennai-4-to-9-years-140426021000,Data Scientist,2026-04-30 19:31:27,ai ml/data scientist,Data Scientist,4.0,False,,"['data science', 'artificial intelligence', 'machine learning', 'science', 'machine', 'intelligence', 'data', 'ml']","data science, artificial intelligence, machine learning, science, machine, intelligence, data, ml","data science, artificial intelligence, machine learning, science, machine, intelligence, data, ml"
Naukri,Data Scientist,Rolls-Royce,6-10 Yrs,Not Disclosed,Pune,"Version control, Machine learning, Agile, Scrum, test driven development, data visualization, Stakeholder management, MATLAB",3+ weeks ago,https://www.naukri.com/job-listings-data-scientist-rolls-royce-pune-6-to-10-years-230226501855,Data Scientist,2026-04-30 19:31:27,data scientist,Data Scientist,6.0,False,,"['version control', 'machine learning', 'agile', 'scrum', 'test driven development', 'data visualization', 'stakeholder management', 'matlab']","version control, machine learning, agile, scrum, test driven development, data visualization, stakeholder management, matlab","version control, machine learning, agile, scrum, test driven development, data visualization, stakeholder management, matlab"
Naukri,Data Scientist,Tata Consultancy Services,4-9 Yrs,Not Disclosed,"Pune, Chennai, Bengaluru","Machine Learning, Predictive Modeling, Artificial Intelligence, Natural Language Processing, Statistics, Deep Learning, Python, Data",2 weeks ago,https://www.naukri.com/job-listings-data-scientist-tata-consultancy-services-pune-chennai-bengaluru-4-to-9-years-140426025793,Data Scientist,2026-04-30 19:31:27,data scientist,Data Scientist,4.0,False,,"['machine learning', 'predictive modeling', 'artificial intelligence', 'natural language processing', 'statistics', 'deep learning', 'python', 'data']","machine learning, predictive modeling, artificial intelligence, natural language processing, statistics, deep learning, python, data","machine learning, predictive modeling, artificial intelligence, natural language processing, statistics, deep learning, python, data"
Naukri,Data Scientist-Artificial Intelligence,IBM,8-9 Yrs,Not Disclosed,Pune,"data scientist, kubernetes, python, github, natural language processing, ai, react, bootstrap",3 weeks ago,https://www.naukri.com/job-listings-data-scientist-artificial-intelligence-ibm-india-pvt-limited-pune-8-to-9-years-060426914816,Data Scientist,2026-04-30 19:31:28,data scientist-artificial intelligence,Data Scientist,8.0,False,,"['data scientist', 'kubernetes', 'python', 'github', 'natural language processing', 'ai', 'react', 'bootstrap']","data scientist, kubernetes, python, github, natural language processing, ai, react, bootstrap","data scientist, kubernetes, python, github, natural language processing, ai, react, bootstrap"
Naukri,Sr Research Data Scientist,Persistent,3-5 Yrs,Not Disclosed,Pune,"GenAI, NLP, Machine Learning, SR, Data, Machine, Natural language processing, Research",3+ weeks ago,https://www.naukri.com/job-listings-sr-research-data-scientist-persistent-pune-3-to-5-years-310326038490,Data Scientist,2026-04-30 19:31:28,sr research data scientist,Data Scientist,3.0,False,,"['genai', 'nlp', 'machine learning', 'sr', 'data', 'machine', 'natural language processing', 'research']","genai, nlp, machine learning, sr, data, machine, natural language processing, research","genai, nlp, machine learning, sr, data, machine, natural language processing, research"
Naukri,Data Scientist - Senior,Cummins,6-11 Yrs,Not Disclosed,Pune,"Computer science, Analytical, Machine learning, Agile, Manager Quality Control, Data mining, Licensing, Analytics",2 days ago,https://www.naukri.com/job-listings-data-scientist-senior-cummins-inc-pune-6-to-11-years-280426502626,Data Scientist,2026-04-30 19:31:29,data scientist - senior,Data Scientist,6.0,False,,"['computer science', 'analytical', 'machine learning', 'agile', 'manager quality control', 'data mining', 'licensing', 'analytics']","computer science, analytical, machine learning, agile, manager quality control, data mining, licensing, analytics","computer science, analytical, machine learning, agile, manager quality control, data mining, licensing, analytics"
Naukri,Lead Data Scientist,Mastercard,12-17 Yrs,Not Disclosed,Pune,"Front end, Linux, Coding, Neural networks, Analytical, Machine learning, Open source, Financial services",3+ weeks ago,https://www.naukri.com/job-listings-lead-data-scientist-mastercard-pune-12-to-17-years-240326500683,Data Scientist,2026-04-30 19:31:29,lead data scientist,Data Scientist,12.0,False,,"['front end', 'linux', 'coding', 'neural networks', 'analytical', 'machine learning', 'open source', 'financial services']","front end, linux, coding, neural networks, analytical, machine learning, open source, financial services","front end, linux, coding, neural networks, analytical, machine learning, open source, financial services"
Naukri,Sr. D&T Data Scientist,General Mills,10-12 Yrs,Not Disclosed,"Hybrid - Pune, Mumbai","Data Science, GCP, Bigquery, Machine Learning, Science, TD, SR, T",2 weeks ago,https://www.naukri.com/job-listings-sr-d-t-data-scientist-general-mills-mumbai-pune-10-to-12-years-130426029777,Data Scientist,2026-04-30 19:31:30,sr. d&t data scientist,Data Scientist,10.0,False,,"['data science', 'gcp', 'bigquery', 'machine learning', 'science', 'td', 'sr', 't']","data science, gcp, bigquery, machine learning, science, td, sr, t","data science, gcp, bigquery, machine learning, science, td, sr, t"
Naukri,Data Scientist (AI/ML)- India,Infosys,5-10 Yrs,Not Disclosed,"Hybrid - Pune, Hyderabad, Bengaluru","Machine Learning, Python, Matplotlib, Jupyter Notebook, Deep Learning, Numpy, Scikit-Learn, SQL",2 weeks ago,https://www.naukri.com/job-listings-data-scientist-ai-ml-india-infosys-hyderabad-pune-bengaluru-5-to-10-years-100426021583,Data Scientist,2026-04-30 19:31:30,data scientist (ai/ml)- india,Data Scientist,5.0,False,,"['machine learning', 'python', 'matplotlib', 'jupyter notebook', 'deep learning', 'numpy', 'scikit-learn', 'sql']","machine learning, python, matplotlib, jupyter notebook, deep learning, numpy, scikit-learn, sql","machine learning, python, matplotlib, jupyter notebook, deep learning, numpy, scikit-learn, sql"
Naukri,Sr Data Scientist - (AI & Healthcare analytics),Fractal Analytics,7-12 Yrs,Not Disclosed,Pune,"Health insurance, Claims, Performance management, HIPAA, Healthcare, healthcare analytics, Project delivery, Stakeholder management",3+ weeks ago,https://www.naukri.com/job-listings-sr-data-scientist-ai-healthcare-analytics-fractal-analytics-ltd-pune-7-to-12-years-240326502698,Data Scientist,2026-04-30 19:31:30,sr data scientist - (ai & healthcare analytics),Data Analyst,7.0,False,,"['health insurance', 'claims', 'performance management', 'hipaa', 'healthcare', 'healthcare analytics', 'project delivery', 'stakeholder management']","health insurance, claims, performance management, hipaa, healthcare, healthcare analytics, project delivery, stakeholder management","health insurance, claims, performance management, hipaa, healthcare, healthcare analytics, project delivery, stakeholder management"
Naukri,Senior Data Scientist Consultant,bp,7-12 Yrs,27.5-35 Lacs PA,Pune,"Pyspark, Advanced Sql Queries, Machine Learning Algorithms, Deep Learning, Python, Advanced Analytics, Consulting, Advance SQL",4 days ago,https://www.naukri.com/job-listings-senior-data-scientist-consultant-bp-pune-7-to-12-years-100426024724,Data Scientist,2026-04-30 19:31:31,senior data scientist consultant,Data Scientist,7.0,False,27.5-35 Lacs PA,"['pyspark', 'advanced sql queries', 'machine learning algorithms', 'deep learning', 'python', 'advanced analytics', 'consulting', 'advance sql']","pyspark, advanced sql queries, machine learning algorithms, deep learning, python, advanced analytics, consulting, advance sql","pyspark, advanced sql queries, machine learning algorithms, deep learning, python, advanced analytics, consulting, advance sql"
Naukri,Data Scientist,EXL,2-5 Yrs,Not Disclosed,"Hybrid - Pune, Bengaluru, Delhi / NCR","Agentic Ai, Generative Ai, Natural Language Processing, Retrieval Augmented Generation, Languages, Artificial Intelligence, Generation, Process",1 week ago,https://www.naukri.com/job-listings-data-scientist-exl-pune-bengaluru-delhi-ncr-2-to-5-years-200426022629,Data Scientist,2026-04-30 19:31:31,data scientist,Data Scientist,2.0,False,,"['agentic ai', 'generative ai', 'natural language processing', 'retrieval augmented generation', 'languages', 'artificial intelligence', 'generation', 'process']","agentic ai, generative ai, natural language processing, retrieval augmented generation, languages, artificial intelligence, generation, process","agentic ai, generative ai, natural language processing, retrieval augmented generation, languages, artificial intelligence, generation, process"
Naukri,Data Scientist,HCLTech,6-8 Yrs,Not Disclosed,"Hybrid - Pune, Hyderabad, Bengaluru","Data Science, Natural Language Processing, Machine Learning, Python, Science, Machine, Processing, Languages",2 weeks ago,https://www.naukri.com/job-listings-data-scientist-hcltech-hyderabad-pune-bengaluru-6-to-8-years-030426017346,Data Scientist,2026-04-30 19:31:31,data scientist,Data Scientist,6.0,False,,"['data science', 'natural language processing', 'machine learning', 'python', 'science', 'machine', 'processing', 'languages']","data science, natural language processing, machine learning, python, science, machine, processing, languages","data science, natural language processing, machine learning, python, science, machine, processing, languages"
Naukri,Senior Data Scientist,Red Hat,4-7 Yrs,Not Disclosed,Pune,"data scientist, kubernetes, python, github, project management, data analytics, data analysis, natural language processing",3+ weeks ago,https://www.naukri.com/job-listings-senior-data-scientist-red-hat-india-pvt-ltd-pune-4-to-7-years-300326909834,Data Scientist,2026-04-30 19:31:31,senior data scientist,Data Scientist,4.0,False,,"['data scientist', 'kubernetes', 'python', 'github', 'project management', 'data analytics', 'data analysis', 'natural language processing']","data scientist, kubernetes, python, github, project management, data analytics, data analysis, natural language processing","data scientist, kubernetes, python, github, project management, data analytics, data analysis, natural language processing"
Naukri,Data Scientist,Infosys,5-9 Yrs,Not Disclosed,"Hybrid - Pune, Hyderabad, Bengaluru","Data Science, Natural Language Processing, Neural Networks, Computer Vision, Python, Langchain, Langgraph, Artificial Intelligence",3+ weeks ago,https://www.naukri.com/job-listings-data-scientist-infosys-hyderabad-pune-bengaluru-5-to-9-years-020426027443,Data Scientist,2026-04-30 19:31:32,data scientist,Data Scientist,5.0,False,,"['data science', 'natural language processing', 'neural networks', 'computer vision', 'python', 'langchain', 'langgraph', 'artificial intelligence']","data science, natural language processing, neural networks, computer vision, python, langchain, langgraph, artificial intelligence","data science, natural language processing, neural networks, computer vision, python, langchain, langgraph, artificial intelligence"
Naukri,Data Scientist,Scry Analytics,3-8 Yrs,Not Disclosed,Pune,"Computer science, deep learning, advanced analytics, data science, Analytical, Machine learning, Cloud, model development",3+ weeks ago,https://www.naukri.com/job-listings-data-scientist-scry-analytics-pune-3-to-8-years-060326504689,Data Scientist,2026-04-30 19:31:32,data scientist,Data Scientist,3.0,False,,"['computer science', 'deep learning', 'advanced analytics', 'data science', 'analytical', 'machine learning', 'cloud', 'model development']","computer science, deep learning, advanced analytics, data science, analytical, machine learning, cloud, model development","computer science, deep learning, advanced analytics, data science, analytical, machine learning, cloud, model development"
Naukri,Senior Data Scientist/ Data Scientist,Fractal Analytics,5-10 Yrs,Not Disclosed,"Pune, Mumbai, Chennai, Gurugram, Bengaluru","RCA, Software design, Version control, Coding, Machine learning, Data structures, Project delivery, Monitoring",3+ weeks ago,https://www.naukri.com/job-listings-senior-data-scientist-data-scientist-fractal-analytics-ltd-mumbai-pune-chennai-gurugram-bengaluru-5-to-10-years-060225508191,Data Scientist,2026-04-30 19:31:32,senior data scientist/ data scientist,Data Scientist,5.0,False,,"['rca', 'software design', 'version control', 'coding', 'machine learning', 'data structures', 'project delivery', 'monitoring']","rca, software design, version control, coding, machine learning, data structures, project delivery, monitoring","rca, software design, version control, coding, machine learning, data structures, project delivery, monitoring"
Naukri,Data Scientist,Jabil Circuit India,2-7 Yrs,Not Disclosed,Pune,"Supply chain, Computer science, Computer vision, Data analysis, Image processing, Machine learning, Data collection, Data processing",Just now,https://www.naukri.com/job-listings-data-scientist-jabil-circuit-pune-2-to-7-years-300426503321,Data Scientist,2026-04-30 19:31:41,data scientist,Data Scientist,2.0,False,,"['supply chain', 'computer science', 'computer vision', 'data analysis', 'image processing', 'machine learning', 'data collection', 'data processing']","supply chain, computer science, computer vision, data analysis, image processing, machine learning, data collection, data processing","supply chain, computer science, computer vision, data analysis, image processing, machine learning, data collection, data processing"
Naukri,Data Scientist,Mindteck,3-8 Yrs,Not Disclosed,Hybrid - Pune,"Gen AI, Data Scientist, LLMs/RAG, Gen, Artificial Intelligence, Data",1 day ago,https://www.naukri.com/job-listings-data-scientist-mindteck-pune-3-to-8-years-290426014067,Data Scientist,2026-04-30 19:31:42,data scientist,Data Scientist,3.0,False,,"['gen ai', 'data scientist', 'llms/rag', 'gen', 'artificial intelligence', 'data']","gen ai, data scientist, llms/rag, gen, artificial intelligence, data","gen ai, data scientist, llms/rag, gen, artificial intelligence, data"
Naukri,Data Scientist,EY,2-6 Yrs,Not Disclosed,"Pune, Hyderabad, Bengaluru","Agentic Ai, Langgraph, Retrieval Augmented Generation, LLM, Function Calling, Semantic Kernel, Langchain, AI Agents",Today,https://www.naukri.com/job-listings-data-scientist-ey-hyderabad-pune-bengaluru-2-to-6-years-300426011989,Data Scientist,2026-04-30 19:31:42,data scientist,Data Scientist,2.0,False,,"['agentic ai', 'langgraph', 'retrieval augmented generation', 'llm', 'function calling', 'semantic kernel', 'langchain', 'ai agents']","agentic ai, langgraph, retrieval augmented generation, llm, function calling, semantic kernel, langchain, ai agents","agentic ai, langgraph, retrieval augmented generation, llm, function calling, semantic kernel, langchain, ai agents"
